{
  "pass": true,
  "severity": "low",
  "issues": [],
  "summary": "Texto em pt-PT AO90 adequado ao 4.º ano; instruções curtas; vocabulário Canva contextualizado em conta escolar Microsoft; sem variantes pt-BR detetadas.",
  "acceptance_checks": [
    "html lang pt-PT",
    "conta @edu.madeira.gov.pt mencionada com segurança",
    "criar apresentações incluído",
    "editar imagem incluído",
    "ferramentas úteis incluídas",
    "diferenciação 🟢/🟡/🔴 compreensível"
  ]
}
